ID,著者,年,タイトル,掲載誌,主目的,データ種別,主要手法,対象地域,DOI_URL,PDF有無,重要度,RQ1関連,RQ2関連,RQ3関連,キーワード,メモ
S1,Ermida et al.,2020,Google Earth Engine open-source code for Land Surface Temperature estimation from the Landsat series,Remote Sensing,LST算出手法の確立,衛星・再解析,SMW法,グローバル,https://www.mdpi.com/2072-4292/12/9/1471,✓,A,○手法基盤,△空間代表性,○GEE活用,SMW;GEE;LST算出;放射率補正;TCWV,本研究で採用する標準手法。NCEP/NCAR TCWV=2.5°に注意
S2,Le Ngoc Hanh & Tran Thi An,年不明,Assessment of Temperature Change in Da Nang City Vietnam Using Remote Sensing and Cloud-Computing Approach,The GIS-IDEAS Journal,都市化とLST変化,衛星,時系列解析・相関分析,ベトナム（ダナン）,記載なし,△（要確認）,A,△相関分析,,◎ベトナム都市,ダナン;NDVI;NDBI;時系列,ベトナム都市の先行事例として重要。発表年・DOI未確定
S3,Onačillová et al.,2022,Combining Landsat 8 and Sentinel-2 Data in Google Earth Engine to Derive Higher Resolution Land Surface Temperature Maps in Urban Environment,Remote Sensing,高解像度LST生成,衛星,ダウンスケーリング,欧州都市,https://www.mdpi.com/2072-4292/14/16/4076,✓,A,○代理指標,◎スケール変換,○限定検証,Sentinel-2;ダウンスケーリング;都市LST;重回帰,RQ2スケール変換手法として重要。R²=0.829
S4,Sun et al.,2019,Quantifying the effects of urban form on land surface temperature in subtropical high-density urban areas using machine learning,Remote Sensing,都市構造とLSTの定量評価,衛星・都市データ,ランダムフォレスト,亜熱帯高密度都市,https://www.mdpi.com/2072-4292/11/8/959,✓,A,◎変数重要度,◎複数指標,,都市構造;ランダムフォレスト;寄与度;建物密度,RQ1の分析モデルとして参考
S5,Osborne & Alvares-Sanches,2019,Quantifying how landscape composition and configuration affect urban land surface temperatures using machine learning and neutral landscapes,Computers Environment and Urban Systems,土地利用構成・配置の影響,リモートセンシング,機械学習・景観指標,英国Southampton,https://doi.org/10.1016/j.compenvurbsys.2019.04.003,✓,A,○近傍変数,◎◎空間配置・リング,△データ依存,構成;配置;景観指標;中立景観モデル;GBM;近傍効果,RQ2スケール設計の核心文献。近傍リング（30-60m等）手法。相関0.956
S6,Garzón et al.,2021,A remote sensing approach for surface urban heat island modeling in a tropical Colombian city using regression analysis and machine learning algorithms,Remote Sensing,熱帯都市のSUHI要因抽出,衛星・土地利用,重回帰・機械学習比較,コロンビア（熱帯都市）,https://doi.org/10.3390/rs13214256,✓,A,○寄与率定量化,△時系列PCA,◎熱帯途上国・放射率,SUHI;熱帯都市;NDVI;NDBI;NDWI;MLR;寄与率;Fcover;放射率比較,熱帯コロンビア都市SUHI。NDWI最大寄与51.46%、NDBI 21.38%。Fcover放射率R²=0.78。MLR R²=0.82、NBML精度95%。RQ1○、RQ3◎
S7,Zhong et al.,2024,Downscaled high spatial resolution images from automated machine learning for assessment of urban structure effects on land surface temperatures,Building and Environment,AutoMLによる高解像度LST,衛星複数,AutoML,都市環境,https://www.sciencedirect.com/science/article/pii/S0360132324007765,×（アクセス不可）,C,△AutoML手法,△高解像度,,AutoML;ダウンスケーリング;都市構造,最新の機械学習手法の動向把握。PDF未入手
S8,Tanoori et al.,2024,Machine learning for urban heat island (UHI) analysis: Predicting land surface temperature (LST) in urban environments,Urban Climate,機械学習によるLST推定,リモートセンシング,複数ML手法比較,都市環境,https://www.sciencedirect.com/science/article/pii/S2212095524001585,×（有料）,B,◎ML手法比較,,,機械学習;UHI;手法比較;予測精度,ML手法の選定参考。PDF購入必要